検索キーワード,タイトル,URL,スニペット,検索日時
Python プログラミング,Welcome to Python.org,https://www.python.org/,"The official home of the Python Programming Language. Python is a programming language that lets you work quickly and integrate systems more effectively.",2025-06-09 14:30:15
機械学習 入門,機械学習 - Wikipedia,https://ja.wikipedia.org/wiki/%E6%A9%9F%E6%A2%B0%E5%AD%A6%E7%BF%92,"機械学習（きかいがくしゅう、英: machine learning、略称: ML）は、コンピューターが明示的にプログラムされることなく学習する能力を与える研究分野である。",2025-06-09 14:30:17
ウェブスクレイピング,ウェブスクレイピング - Wikipedia,https://ja.wikipedia.org/wiki/%E3%82%A6%E3%82%A7%E3%83%96%E3%82%B9%E3%82%AF%E3%83%AC%E3%82%A4%E3%83%94%E3%83%B3%E3%82%B0,"ウェブスクレイピング（英語: Web scraping）は、ウェブサイトから情報を抽出するコンピュータソフトウェア技術のこと。ウェブ・スクレーパー、ウェブ・ハーベスタ...",2025-06-09 14:30:19
データサイエンス,データサイエンスとは | Microsoft Azure,https://azure.microsoft.com/ja-jp/resources/cloud-computing-dictionary/what-is-data-science/,"データサイエンスは、統計学、科学的手法、人工知能 (AI)、データ分析を組み合わせて、データから価値と洞察を抽出する分野です。",2025-06-09 14:30:21
人工知能 AI,人工知能 - Wikipedia,https://ja.wikipedia.org/wiki/%E4%BA%BA%E5%B7%A5%E7%9F%A5%E8%83%BD,"人工知能（じんこうちのう、英: artificial intelligence、AI）とは、人間の知能に似た処理を行うコンピュータシステムの研究・開発、及びそのシステムそのものを指す。",2025-06-09 14:30:23
